{
  "build": {
    "compiler": "rustc 1.98.1 (48a229cea 2026-09-01)",
    "features": [
      "avian2d",
      "avian3d",
      "bevy_rapier2d",
      "bevy_rapier3d",
      "jolt"
    ],
    "rustflags": "-C link-arg=-fuse-ld=bfd"
  },
  "created_at": "2026-10-10T04:26:56.510Z",
  "environment": {
    "browser": null,
    "cpu": "AMD Ryzen 9 5950X 16-Core Processor",
    "gpu": null,
    "logical_cores": 32,
    "machine": "nixos-5950x-5070ti",
    "memory_bytes": 134967296000,
    "notes": "Bevy integration steps include transform synchronization. Interactive host load is not controlled. Jolt retains its inline job system in both profiles. Collected sequentially without concurrent project builds. Other host work, CPU affinity, power settings, and thermals were uncontrolled.",
    "os": "Linux (NixOS 26.11)",
    "profile": "baseline",
    "runtime": "native",
    "target": "x86_64-unknown-linux-gnu",
    "threads": 1
  },
  "measurements": [
    {
      "awake_bodies": 10000,
      "engine": "avian",
      "finite": true,
      "min_y": 0.4983944296836853,
      "plan": {
        "batch_steps": 4,
        "repeats": 3,
        "samples": 30,
        "warmup_steps": 60
      },
      "queries": {
        "hits": 0,
        "rays": 0
      },
      "readback_ms": null,
      "samples_ms": [
        63.532993999999995,
        66.616598,
        63.737519000000006,
        56.883604,
        60.094411,
        63.779819,
        63.33873700000001,
        63.675881000000004,
        64.059347,
        65.415784,
        59.359134,
        58.645368000000005,
        58.144453999999996,
        57.596726000000004,
        56.771640999999995,
        65.493065,
        59.598514,
        62.030514000000004,
        56.333757999999996,
        56.956878,
        58.72052,
        60.279435,
        61.665853,
        58.501225,
        62.864691,
        67.50759000000001,
        59.475175,
        57.129167,
        58.860581,
        62.634656,
        72.293005,
        60.359431,
        60.474022000000005,
        58.497103,
        60.796985,
        65.35840499999999,
        68.429006,
        65.21481,
        67.630404,
        60.148891000000006,
        68.491757,
        57.847847,
        60.188984,
        73.40767199999999,
        65.173603,
        61.689642000000006,
        63.078903000000004,
        63.93428900000001,
        57.091923,
        62.961175999999995,
        69.414203,
        60.769677,
        63.772252,
        68.322833,
        63.09048000000001,
        66.163653,
        60.360685,
        56.796861,
        58.286223,
        63.121793999999994,
        62.177403,
        58.164978,
        55.611224,
        56.871873,
        81.93621399999999,
        67.019279,
        67.641299,
        61.203784,
        56.481767000000005,
        57.666423,
        63.793842000000005,
        61.264145,
        59.519611,
        66.063514,
        56.658930000000005,
        59.879764,
        57.689248,
        58.561542,
        56.942864,
        61.759122,
        56.997515,
        56.698202,
        68.08958299999999,
        60.915472,
        60.464251,
        58.255085,
        64.147698,
        61.146648,
        59.667004000000006,
        60.74917
      ],
      "scene_fingerprint": "6f0c24fe6c6ecf39cb717766b1b83bf0f8ea5e8e8f0590438efa65455b3ad0d6",
      "scope": "bevy-step",
      "settings": {
        "ccd": "discrete",
        "count": 10000,
        "dimension": "3d",
        "friction": 0.5,
        "gravity": 9.8100004196167,
        "hz": 60,
        "restitution": 0.0,
        "scenario": "boxes",
        "seed": 42,
        "sleeping": "disabled",
        "solver_effort": 4
      },
      "statistics": {
        "cv_percent": 7.172570812056575,
        "max_ms": 81.93621399999999,
        "mean_ms": 61.85452902222221,
        "median_ms": 60.8562285,
        "min_ms": 55.611224,
        "p95_ms": 68.491757,
        "sample_count": 90,
        "stddev_ms": 4.436559894582974
      }
    }
  ],
  "schema_version": 1,
  "source": "published",
  "versions": {
    "avian": "0.7.0",
    "bevy": "0.19.1",
    "bevy_rapier": "0.36.0",
    "jolt_js": "1.1.0",
    "nexus": "0.6.0",
    "oxijolt": "1.0.1+jolt-5.6.0",
    "rapier": "0.35.0-glamx0.2",
    "revision": "f283ac2a289ceab679dcfefdf72208bac1c4106e"
  }
}
