{
  "build": {
    "compiler": "rustc 1.98.1 (48a229cea 2026-09-01)",
    "features": [
      "nexus-webgpu",
      "fixed-pair-capacity",
      "64-solver-colors"
    ],
    "rustflags": "-C link-arg=-fuse-ld=bfd"
  },
  "created_at": "2026-10-10T04:25:05.949Z",
  "environment": {
    "browser": null,
    "cpu": "AMD Ryzen 9 5950X 16-Core Processor",
    "gpu": {
      "backend": "Vulkan",
      "driver": "595.104.02",
      "name": "NVIDIA GeForce RTX 5070 Ti"
    },
    "logical_cores": 32,
    "machine": "nixos-5950x-5070ti",
    "memory_bytes": 134967296000,
    "notes": "GPU totals include submission, completion, pose readback, and capacity validation. Readback includes GPU completion wait. Interactive host load is not controlled. Collected sequentially without concurrent project builds. Other host work, CPU affinity, power settings, and thermals were uncontrolled.",
    "os": "Linux (NixOS 26.11)",
    "profile": "gpu",
    "runtime": "native",
    "target": "x86_64-unknown-linux-gnu",
    "threads": 1
  },
  "measurements": [
    {
      "awake_bodies": 10000,
      "engine": "nexus",
      "finite": true,
      "min_y": 0.4985281825065613,
      "plan": {
        "batch_steps": 4,
        "repeats": 3,
        "samples": 30,
        "warmup_steps": 60
      },
      "queries": {
        "hits": 0,
        "rays": 0
      },
      "readback_ms": [
        2.9837309999999997,
        2.684276,
        3.236214,
        3.427163,
        3.160627,
        3.169714,
        2.962116,
        3.101047,
        3.0977930000000002,
        3.056992,
        3.267017,
        3.005868,
        3.005773,
        3.276006,
        3.107669,
        3.2199809999999998,
        2.9887490000000003,
        3.1291700000000002,
        3.5902719999999997,
        3.089491,
        3.1340090000000003,
        3.011065,
        2.919646,
        3.0030780000000004,
        2.964964,
        3.110177,
        3.528491,
        3.3197360000000002,
        3.10925,
        3.256106,
        3.3019920000000003,
        2.5462179999999996,
        3.22233,
        3.1225799999999997,
        3.044416,
        3.035809,
        3.27407,
        3.4557569999999997,
        3.082407,
        2.874902,
        2.975684,
        2.8558,
        2.888618,
        2.8885400000000003,
        3.010847,
        3.161699,
        3.110618,
        3.065801,
        3.146728,
        3.2450360000000003,
        3.10887,
        3.063023,
        2.984889,
        3.5812980000000003,
        3.16634,
        3.179432,
        3.38851,
        3.341339,
        3.3350570000000004,
        3.246939,
        2.8963639999999997,
        2.4182129999999997,
        3.0359570000000002,
        3.00176,
        3.068992,
        2.985838,
        2.900881,
        3.030161,
        2.856086,
        3.071692,
        2.94458,
        2.9536729999999998,
        2.966472,
        2.988157,
        2.991947,
        2.876775,
        2.890653,
        2.974316,
        3.540992,
        3.002387,
        3.581122,
        3.941175,
        3.850114,
        4.278517,
        3.797702,
        3.385342,
        2.925347,
        2.9672829999999997,
        3.092423,
        2.972312
      ],
      "samples_ms": [
        6.416573,
        10.219608,
        11.413599,
        9.335851,
        7.833385,
        6.8333639999999995,
        6.5235520000000005,
        6.570357,
        6.760918,
        6.790376,
        7.066756000000001,
        6.644078,
        6.512283,
        7.064847,
        7.541078,
        7.097794,
        7.0328040000000005,
        6.752457,
        7.378149,
        6.573501,
        6.685519,
        6.5147699999999995,
        7.445671,
        7.0541789999999995,
        6.567574,
        6.92028,
        7.447908,
        6.944691000000001,
        7.103084,
        7.249327,
        7.159124,
        6.807949,
        6.9154409999999995,
        7.486996,
        7.038345,
        6.935399,
        10.219856,
        13.619733,
        7.790312,
        7.194844,
        6.70876,
        6.3628540000000005,
        6.74456,
        6.458917,
        6.516571,
        6.5996,
        7.341911,
        7.478588,
        7.211072,
        7.38279,
        7.087407000000001,
        6.924493,
        7.534318,
        7.52111,
        6.960426,
        6.943942,
        6.972493,
        7.8248120000000005,
        9.035872000000001,
        7.782033,
        6.640582,
        9.47079,
        7.508211,
        7.456443999999999,
        7.532599,
        7.248485,
        6.6541,
        6.7563450000000005,
        6.816377,
        6.826236000000001,
        6.904981,
        6.5446539999999995,
        6.673624,
        6.7014190000000005,
        7.161749,
        6.633616,
        6.938249,
        6.937475,
        7.542012,
        6.801462,
        7.751944,
        8.304872,
        8.199168,
        15.002086,
        9.192729,
        8.145104,
        7.6533690000000005,
        7.083998,
        6.795819,
        7.038952999999999
      ],
      "scene_fingerprint": "6f0c24fe6c6ecf39cb717766b1b83bf0f8ea5e8e8f0590438efa65455b3ad0d6",
      "scope": "gpu-step-readback",
      "settings": {
        "ccd": "discrete",
        "count": 10000,
        "dimension": "3d",
        "friction": 0.5,
        "gravity": 9.8100004196167,
        "hz": 60,
        "restitution": 0.0,
        "scenario": "boxes",
        "seed": 42,
        "sleeping": "disabled",
        "solver_effort": 4
      },
      "statistics": {
        "cv_percent": 18.2967863185984,
        "max_ms": 15.002086,
        "mean_ms": 7.441914588888887,
        "median_ms": 7.046565999999999,
        "min_ms": 6.3628540000000005,
        "p95_ms": 10.219608,
        "sample_count": 90,
        "stddev_ms": 1.3616312103416002
      }
    }
  ],
  "schema_version": 1,
  "source": "published",
  "versions": {
    "avian": "0.7.0",
    "bevy": "0.19.1",
    "bevy_rapier": "0.36.0",
    "jolt_js": "1.1.0",
    "nexus": "0.6.0",
    "oxijolt": "1.0.1+jolt-5.6.0",
    "rapier": "0.35.0-glamx0.2",
    "revision": "7ca79bec95c6c497c96a9e2efe16f5943ad9dd9d"
  }
}
